{"$schema":"https://json-schema.org/draft/2020-12/schema","title":"Protocolo sintético","type":"object","additionalProperties":false,"required":["protocol_id","title","specialty","version","status","effective_date","sections"],"properties":{"protocol_id":{"type":"string","pattern":"^PR-[A-Z0-9-]+$"},"title":{"type":"string","minLength":1},"specialty":{"type":"string","minLength":1},"version":{"type":"string","minLength":1},"status":{"enum":["active","inactive"]},"effective_date":{"type":"string","format":"date"},"sections":{"type":"array","minItems":1,"items":{"type":"object","additionalProperties":false,"required":["section_id","heading","content"],"properties":{"section_id":{"type":"string","minLength":1},"heading":{"type":"string","minLength":1},"content":{"type":"string","minLength":1}}}}}}

